{
  "schema_version": "1.0",
  "task": {"issue": 164, "epic": 162, "acceptance_criteria": ["Schemas and examples pass deterministic contract tests."]},
  "git": {"base_ref": "roadmap/162-agent-orchestration", "base_sha": "1111111111111111111111111111111111111111", "head_ref": "docs/164-agent-contracts", "head_sha": null},
  "scope": {"allowed_paths": ["docs/", "examples/agent-contracts/", "tests/"], "excluded_changes": ["runtime", "public CLI", "dependencies"]},
  "permissions": {"allowed_tools": ["filesystem", "git-read", "local-quality-gate"], "workspace_write": true, "external_write": false, "commit": false, "push": false, "merge": false},
  "budget": {"max_minutes": 60, "max_repair_iterations": 2, "max_report_chars": 8000},
  "required_checks": ["pytest -q", "ruff check .", "mypy .", "pre-commit run --all-files"],
  "trust_source": {"kind": "base_sha", "pinned_before_head_checkout": true}
}
